,Date,Prison name,Country,Succeeded,Escapee(s),Details
43,"March 22, 2012","Sheksna, Penal colony N17",Russia,Yes,Alexey Shestakov,"Shestakov was whisked away from a penal colony on a Mil Mi-2 helicopter hijacked by his accomplices, and re-captured shortly after his escape.[65]"
44,"February 24, 2013","Trikala Prison, Trikala",Greece,No,Panagiotis Vlastos,"A chartered helicopter, carrying two armed passengers, a pilot, and a technician, first tried to rip off the chicken-wire fence surrounding the prison with a hook dangling from a rope. When that was unsuccessful, a rope was lowered down to carry away Vlastos. Another prisoner, an unnamed Albanian national in the courtyard at the time, may also have been part of the escape plan.
At the same time, the armed passengers used AK-47 rifles and Uzi submachine guns to fire on the prison guards. One guard, who was inside a post, was slightly injured by shards of flying glass. He and others returned fire, injuring Vlastos, who had managed to climb into the helicopter, as well as the helicopter's technician. Vlastos fell from a height of about 3 meters (10 feet) into the courtyard, and the helicopter was eventually grounded in the parking lot.
Prison officials said that they recovered well over 500 bullets fired from the helicopter. The Ministry of Justice added that the helicopter passengers also carried, but did not use, ""improvised explosive devices""."
45,"March 17, 2013","Saint-Jérôme Detention Facility, Quebec",Canada,Yes,Benjamin Hudon-BarbeauDanny Provençal,"Two inmates escaped from the prison by clambering up a rope from an awaiting helicopter, which had been hijacked at gunpoint by two accomplices. Upon landing, the two men entered a waiting vehicle, in which they drove to a chalet in the Chertsey area and forced their way in. Local residents reported the incident, and only a few hours later the suspects again drove off, but were soon surrounded by police vehicles, at which point they exited their vehicle and opened fire, with the police returning fire. Fleeing on foot, they were soon captured and the last of the suspects was apprehended overnight. There were no serious injuries reported.[66]"
46,"June 7, 2014","Orsainville Detention Facility, Quebec",Canada,Yes,Yves DenisDenis LefebvreSerge Pomerleau,Three detainees awaiting trial for murder escaped from the prison at around 7:45 p.m. ET.[67] The three men were arrested a couple weeks later and returned to the same facility from which they previously escaped.[68]
47,"February 22, 2016",Thiva,Greece,No,Pola RoupaNikos Maziotis,"In 2013, Maziotis was convicted in absentia to 50 years in prison for setting up the now-defunct Revolutionary Struggle terrorist group, simple complicity in attempted murder, and a series of attacks claimed by the group. He had been on the run since 2012 and was arrested in July 2014. According to the anti-terrorist squad, the helicopter was leased by a woman who has since been identified by the pilot as Maziotis' wife, Pola Roupa, at Ermionida. The helicopter was supposed to fly to the island of Kythnos after picking up six more passengers. Anti-terror police said that the helicopter was near Athens when Roupa pulled out a gun and told the pilot to redirect the aircraft towards the city. The pilot immediately tried to disarm her, which caused him to lose control of the helicopter and start to lose altitude. During the struggle, Roupa shot at him three times without injuring him. Instead, the bullets pierced the instruments. The pilot managed to land the helicopter at an uninhabited mountainous area near Thiva. Roupa immediately opened the door and ran away.[69]"
48,"July 1, 2018","Réau, near Paris",France,Yes,Rédoine Faïd,"Faïd was helped by several heavily armed men who created a diversion at the prison entrance while the helicopter landed in the courtyard. The helicopter was hijacked along with the pilot, who was later released unharmed but in shock.[70]"
49,"September 25, 2020","Forest prison, Brussels",Belgium,No,Kristel A.,"Three armed men hijacked a Eurocopter AS355 helicopter in Antwerp. After take-off from Antwerp Airport, the pilot, a 35-year-old woman, was forced to fly to the women's prison. Unable to land, after more than an hour the pilot was forced to land the helicopter close to a highway carpark near Hélécine, 40 km east of Brussels. The three hijackers escaped, while the pilot afterwards flew the helicopter to the base of the Federal Police Air Support Detachment.[71] Four people were arrested two days later in connection with the hijacking.[72] Mike G., aged 24 from Tongeren, a convicted drug dealer released from jail but still under electronic surveillance, was arrested under the suspicion of having organised the failed prison break of his wife Kristel A., aged 27, who is awaiting trial for murder.[73]"
